{
  "schemaVersion": 1,
  "manufacturer": "daikin",
  "family": "Siesta ATXP-N9 exact indoor references",
  "market": "Daikin France official technical product-table snapshots; retrieved 2026-10-11. Current market availability of every exact suffix is not independently established.",
  "checkedAt": "2026-10-11",
  "sources": [
    {
      "id": "daikin-fr-atxp-n9",
      "url": "https://www.daikin.fr/fr_fr/products/product.table.html/ATXP-N9.html",
      "title": "Daikin France ATXP-N9 technical table",
      "edition": "Official online product technical table; snapshot retrieved 2026-10-11",
      "retrievedAt": "2026-10-11"
    }
  ],
  "units": [
    {
      "modelReference": "ATXP20N5V1B9",
      "unitType": "indoor",
      "status": "unknown",
      "identityEvidence": {
        "sourceId": "daikin-fr-atxp-n9",
        "locator": "Exact full model-reference table header",
        "excerpt": "ATXP20N5V1B9"
      },
      "facts": [
        {
          "key": "height",
          "value": 286,
          "unit": "mm",
          "evidence": {
            "sourceId": "daikin-fr-atxp-n9",
            "locator": "Exact full-reference column ATXP20N5V1B9; Dimensions / Unit / Height, Width, Depth",
            "excerpt": "ATXP20N5V1B9 | Dimensions | Unit | Height/Width/Depth | mm | 286/770/225"
          }
        },
        {
          "key": "width",
          "value": 770,
          "unit": "mm",
          "evidence": {
            "sourceId": "daikin-fr-atxp-n9",
            "locator": "Exact full-reference column ATXP20N5V1B9; Dimensions / Unit / Height, Width, Depth",
            "excerpt": "ATXP20N5V1B9 | Dimensions | Unit | Height/Width/Depth | mm | 286/770/225"
          }
        },
        {
          "key": "depth",
          "value": 225,
          "unit": "mm",
          "evidence": {
            "sourceId": "daikin-fr-atxp-n9",
            "locator": "Exact full-reference column ATXP20N5V1B9; Dimensions / Unit / Height, Width, Depth",
            "excerpt": "ATXP20N5V1B9 | Dimensions | Unit | Height/Width/Depth | mm | 286/770/225"
          }
        }
      ],
      "ratings": [],
      "compatibility": [],
      "unknowns": [
        "France product table establishes exact listed reference and physical dimensions; market availability/status for this exact suffix is unverified.",
        "Cooling/heating nominal capacity and fan airflow are not used in this staged extraction; no class or flow inferred."
      ]
    },
    {
      "modelReference": "ATXP25N5V1B9",
      "unitType": "indoor",
      "status": "unknown",
      "identityEvidence": {
        "sourceId": "daikin-fr-atxp-n9",
        "locator": "Exact full model-reference table header",
        "excerpt": "ATXP25N5V1B9"
      },
      "facts": [
        {
          "key": "height",
          "value": 286,
          "unit": "mm",
          "evidence": {
            "sourceId": "daikin-fr-atxp-n9",
            "locator": "Exact full-reference column ATXP25N5V1B9; Dimensions / Unit / Height, Width, Depth",
            "excerpt": "ATXP25N5V1B9 | Dimensions | Unit | Height/Width/Depth | mm | 286/770/225"
          }
        },
        {
          "key": "width",
          "value": 770,
          "unit": "mm",
          "evidence": {
            "sourceId": "daikin-fr-atxp-n9",
            "locator": "Exact full-reference column ATXP25N5V1B9; Dimensions / Unit / Height, Width, Depth",
            "excerpt": "ATXP25N5V1B9 | Dimensions | Unit | Height/Width/Depth | mm | 286/770/225"
          }
        },
        {
          "key": "depth",
          "value": 225,
          "unit": "mm",
          "evidence": {
            "sourceId": "daikin-fr-atxp-n9",
            "locator": "Exact full-reference column ATXP25N5V1B9; Dimensions / Unit / Height, Width, Depth",
            "excerpt": "ATXP25N5V1B9 | Dimensions | Unit | Height/Width/Depth | mm | 286/770/225"
          }
        }
      ],
      "ratings": [],
      "compatibility": [],
      "unknowns": [
        "France product table establishes exact listed reference and physical dimensions; market availability/status for this exact suffix is unverified.",
        "Cooling/heating nominal capacity and fan airflow are not used in this staged extraction; no class or flow inferred."
      ]
    },
    {
      "modelReference": "ATXP35N5V1B9",
      "unitType": "indoor",
      "status": "unknown",
      "identityEvidence": {
        "sourceId": "daikin-fr-atxp-n9",
        "locator": "Exact full model-reference table header",
        "excerpt": "ATXP35N5V1B9"
      },
      "facts": [
        {
          "key": "height",
          "value": 286,
          "unit": "mm",
          "evidence": {
            "sourceId": "daikin-fr-atxp-n9",
            "locator": "Exact full-reference column ATXP35N5V1B9; Dimensions / Unit / Height, Width, Depth",
            "excerpt": "ATXP35N5V1B9 | Dimensions | Unit | Height/Width/Depth | mm | 286/770/225"
          }
        },
        {
          "key": "width",
          "value": 770,
          "unit": "mm",
          "evidence": {
            "sourceId": "daikin-fr-atxp-n9",
            "locator": "Exact full-reference column ATXP35N5V1B9; Dimensions / Unit / Height, Width, Depth",
            "excerpt": "ATXP35N5V1B9 | Dimensions | Unit | Height/Width/Depth | mm | 286/770/225"
          }
        },
        {
          "key": "depth",
          "value": 225,
          "unit": "mm",
          "evidence": {
            "sourceId": "daikin-fr-atxp-n9",
            "locator": "Exact full-reference column ATXP35N5V1B9; Dimensions / Unit / Height, Width, Depth",
            "excerpt": "ATXP35N5V1B9 | Dimensions | Unit | Height/Width/Depth | mm | 286/770/225"
          }
        }
      ],
      "ratings": [],
      "compatibility": [],
      "unknowns": [
        "France product table establishes exact listed reference and physical dimensions; market availability/status for this exact suffix is unverified.",
        "Cooling/heating nominal capacity and fan airflow are not used in this staged extraction; no class or flow inferred."
      ]
    }
  ],
  "unresolvedReferences": []
}
